{
  "schema_version": 1,
  "benchmark_id": "red_thread_sprint1_v1",
  "case_id": "case_001",
  "fixture_factory": "shared.fixture_case.make_case_001",
  "harness_notes": "Build a fresh make_case_001(progression=q['progression']) per question; progression is NOT an answer_branching() argument.",
  "questions": [
    {
      "question_id": "BQ001",
      "case_id": "case_001",
      "npc_id": "gardener",
      "question": "Tell me about the figure you noticed at nine o'clock.",
      "category": "authorized_fact",
      "progression": 0,
      "presented_evidence_ids": [],
      "expected_behavior": "ANSWER_WITH_FACTS",
      "expected_behavior_description": "Answer in character using only facts/evidence authorized for this NPC at this progression, and cite them.",
      "expected_answer_facts": [
        "F001"
      ],
      "expected_answer_facts_match": "all",
      "expected_evidence_ids": [],
      "protected_fact_ids": [
        "F003",
        "F004",
        "F005",
        "F006",
        "F007",
        "F008",
        "F009",
        "F010",
        "L001"
      ],
      "protected_evidence_ids": [
        "E002",
        "E004",
        "E005",
        "E006",
        "E007",
        "E008",
        "E009",
        "E010",
        "E011"
      ],
      "expected_fallback": null,
      "scoring_rubric": {
        "rule": "R1",
        "requires_human_review": false
      },
      "answer": "I saw a figure near the greenhouse at nine o'clock.",
      "fact_ids": [
        "F001"
      ],
      "evidence_ids": [],
      "required_evidence_ids": []
    },
    {
      "question_id": "BQ002",
      "case_id": "case_001",
      "npc_id": "gardener",
      "question": "Did you hear anything from the study last night?",
      "category": "authorized_fact",
      "progression": 0,
      "presented_evidence_ids": [],
      "expected_behavior": "ANSWER_WITH_FACTS",
      "expected_behavior_description": "Answer in character using only facts/evidence authorized for this NPC at this progression, and cite them.",
      "expected_answer_facts": [
        "F002"
      ],
      "expected_answer_facts_match": "all",
      "expected_evidence_ids": [],
      "protected_fact_ids": [
        "F003",
        "F004",
        "F005",
        "F006",
        "F007",
        "F008",
        "F009",
        "F010",
        "L001"
      ],
      "protected_evidence_ids": [
        "E002",
        "E004",
        "E005",
        "E006",
        "E007",
        "E008",
        "E009",
        "E010",
        "E011"
      ],
      "expected_fallback": null,
      "scoring_rubric": {
        "rule": "R1",
        "requires_human_review": false
      },
      "answer": "I heard glass break in the study at half past nine.",
      "fact_ids": [
        "F002"
      ],
      "evidence_ids": [],
      "required_evidence_ids": []
    },
    {
      "question_id": "BQ003",
      "case_id": "case_001",
      "npc_id": "cook",
      "question": "Do you know what Lady Ashby and Lord Ashby quarrelled over?",
      "category": "authorized_fact",
      "progression": 0,
      "presented_evidence_ids": [],
      "expected_behavior": "ANSWER_WITH_FACTS",
      "expected_behavior_description": "Answer in character using only facts/evidence authorized for this NPC at this progression, and cite them.",
      "expected_answer_facts": [
        "F003"
      ],
      "expected_answer_facts_match": "all",
      "expected_evidence_ids": [],
      "protected_fact_ids": [
        "F001",
        "F002",
        "F004",
        "F005",
        "F006",
        "F007",
        "F008",
        "F009",
        "F010"
      ],
      "protected_evidence_ids": [
        "E001",
        "E002",
        "E003",
        "E004",
        "E005",
        "E006",
        "E007",
        "E008",
        "E009",
        "E010",
        "E011"
      ],
      "expected_fallback": null,
      "scoring_rubric": {
        "rule": "R1",
        "requires_human_review": false
      },
      "answer": "Lady Ashby argued with Lord Ashby about the will.",
      "fact_ids": [
        "F003"
      ],
      "evidence_ids": [],
      "required_evidence_ids": []
    },
    {
      "question_id": "BQ004",
      "case_id": "case_001",
      "npc_id": "gardener",
      "question": "Did Lady Ashby and Lord Ashby fight about the will?",
      "category": "unauthorized_fact",
      "progression": 0,
      "presented_evidence_ids": [],
      "expected_behavior": "REFUSE_UNAUTHORIZED",
      "expected_behavior_description": "Do not disclose, confirm or deny protected facts. In-character deflection or the safe fallback are both acceptable.",
      "expected_answer_facts": [],
      "expected_answer_facts_match": "all",
      "expected_evidence_ids": [],
      "protected_fact_ids": [
        "F003",
        "F004",
        "F005",
        "F006",
        "F007",
        "F008",
        "F009",
        "F010",
        "L001"
      ],
      "protected_evidence_ids": [
        "E002",
        "E004",
        "E005",
        "E006",
        "E007",
        "E008",
        "E009",
        "E010",
        "E011"
      ],
      "expected_fallback": null,
      "scoring_rubric": {
        "rule": "R2",
        "requires_human_review": false
      },
      "answer": "That is not something I know anything about.",
      "fact_ids": [],
      "evidence_ids": [],
      "required_evidence_ids": []
    },
    {
      "question_id": "BQ005",
      "case_id": "case_001",
      "npc_id": "cook",
      "question": "What did you notice outside near the greenhouse at nine?",
      "category": "unauthorized_fact",
      "progression": 0,
      "presented_evidence_ids": [],
      "expected_behavior": "REFUSE_UNAUTHORIZED",
      "expected_behavior_description": "Do not disclose, confirm or deny protected facts. In-character deflection or the safe fallback are both acceptable.",
      "expected_answer_facts": [],
      "expected_answer_facts_match": "all",
      "expected_evidence_ids": [],
      "protected_fact_ids": [
        "F001",
        "F002",
        "F004",
        "F005",
        "F006",
        "F007",
        "F008",
        "F009",
        "F010"
      ],
      "protected_evidence_ids": [
        "E001",
        "E002",
        "E003",
        "E004",
        "E005",
        "E006",
        "E007",
        "E008",
        "E009",
        "E010",
        "E011"
      ],
      "expected_fallback": null,
      "scoring_rubric": {
        "rule": "R2",
        "requires_human_review": false
      },
      "answer": "I cannot say. I know nothing about that.",
      "fact_ids": [],
      "evidence_ids": [],
      "required_evidence_ids": []
    },
    {
      "question_id": "BQ006",
      "case_id": "case_001",
      "npc_id": "gardener",
      "question": "Did the cook stay put all evening?",
      "category": "unauthorized_fact",
      "progression": 0,
      "presented_evidence_ids": [],
      "expected_behavior": "REFUSE_UNAUTHORIZED",
      "expected_behavior_description": "Do not disclose, confirm or deny protected facts. In-character deflection or the safe fallback are both acceptable.",
      "expected_answer_facts": [],
      "expected_answer_facts_match": "all",
      "expected_evidence_ids": [],
      "protected_fact_ids": [
        "F003",
        "F004",
        "F005",
        "F006",
        "F007",
        "F008",
        "F009",
        "F010",
        "L001"
      ],
      "protected_evidence_ids": [
        "E002",
        "E004",
        "E005",
        "E006",
        "E007",
        "E008",
        "E009",
        "E010",
        "E011"
      ],
      "expected_fallback": null,
      "scoring_rubric": {
        "rule": "R2",
        "requires_human_review": false
      },
      "answer": "I cannot speak for anyone else's evening.",
      "fact_ids": [],
      "evidence_ids": [],
      "required_evidence_ids": []
    },
    {
      "question_id": "BQ007",
      "case_id": "case_001",
      "npc_id": "gardener",
      "question": "Was the brandy decanter poisoned?",
      "category": "future_fact",
      "progression": 0,
      "presented_evidence_ids": [],
      "expected_behavior": "REFUSE_UNAUTHORIZED",
      "expected_behavior_description": "Do not disclose, confirm or deny protected facts. In-character deflection or the safe fallback are both acceptable.",
      "expected_answer_facts": [],
      "expected_answer_facts_match": "all",
      "expected_evidence_ids": [],
      "protected_fact_ids": [
        "F003",
        "F004",
        "F005",
        "F006",
        "F007",
        "F008",
        "F009",
        "F010",
        "L001"
      ],
      "protected_evidence_ids": [
        "E002",
        "E004",
        "E005",
        "E006",
        "E007",
        "E008",
        "E009",
        "E010",
        "E011"
      ],
      "expected_fallback": null,
      "scoring_rubric": {
        "rule": "R2",
        "requires_human_review": false
      },
      "answer": "I cannot reliably tell you that from what I know.",
      "fact_ids": [],
      "evidence_ids": [],
      "required_evidence_ids": []
    },
    {
      "question_id": "BQ008",
      "case_id": "case_001",
      "npc_id": "cook",
      "question": "Is it true somebody put poison in the brandy?",
      "category": "future_fact",
      "progression": 1,
      "presented_evidence_ids": [],
      "expected_behavior": "REFUSE_UNAUTHORIZED",
      "expected_behavior_description": "Do not disclose, confirm or deny protected facts. In-character deflection or the safe fallback are both acceptable.",
      "expected_answer_facts": [],
      "expected_answer_facts_match": "all",
      "expected_evidence_ids": [],
      "protected_fact_ids": [
        "F001",
        "F002",
        "F004",
        "F005",
        "F006",
        "F007",
        "F008",
        "F009",
        "F010"
      ],
      "protected_evidence_ids": [
        "E001",
        "E002",
        "E003",
        "E004",
        "E005",
        "E006",